[
  {
    "schema_version": "1.0.0",
    "id": "MOS-0001",
    "slug": "great-mosque-kairouan",
    "names": {
      "en": "Great Mosque of Kairouan",
      "fr": "Grande Mosquée de Kairouan",
      "ar": "الجامع الكبير بالقيروان",
      "original": {
        "value": "جامع عقبة بن نافع",
        "language": "ar"
      }
    },
    "location": {
      "city": "Kairouan",
      "country": "Tunisia",
      "country_iso2": "TN",
      "coordinates": null
    },
    "chronology": {
      "foundation": {
        "display": "670 CE",
        "start_year": 670,
        "end_year": 670,
        "precision": "year",
        "certainty": "documented",
        "event_type": "foundation",
        "source_ids": [
          "SRC-KAI-SMART"
        ],
        "sort_year": 670
      },
      "present_structure": {
        "display": "Primarily ninth century (rebuilding begun 836)",
        "start_year": 836,
        "end_year": 875,
        "precision": "range",
        "certainty": "documented",
        "event_type": "major_surviving_phase",
        "source_ids": [
          "SRC-KAI-UNESCO",
          "SRC-KAI-SMART"
        ],
        "sort_year": null
      },
      "phases": [
        {
          "id": "PH-MOS-0001-01",
          "event_type": "foundation",
          "display_date": "670",
          "start_year": 670,
          "end_year": 670,
          "description_en": "Friday mosque founded by Uqba ibn Nafi according to scholarly interpretation.",
          "certainty": "documented",
          "source_ids": [
            "SRC-KAI-SMART"
          ]
        },
        {
          "id": "PH-MOS-0001-02",
          "event_type": "reconstruction",
          "display_date": "836 onward; ninth century",
          "start_year": 836,
          "end_year": 875,
          "description_en": "Major Aghlabid rebuilding, followed by further ninth-century interventions.",
          "certainty": "documented",
          "source_ids": [
            "SRC-KAI-SMART",
            "SRC-KAI-UNESCO"
          ]
        }
      ]
    },
    "architectural_profile": {
      "traditions": [
        "early_islamic",
        "aghlabid",
        "maghrebi"
      ],
      "typologies": [
        "hypostyle",
        "courtyard"
      ],
      "materials": [
        "stone",
        "brick",
        "timber"
      ],
      "elements": [
        "minaret",
        "courtyard",
        "prayer_hall",
        "mihrab"
      ]
    },
    "heritage": {
      "relationship": "within_inscribed_property",
      "designation_name": "Kairouan",
      "inscription_year": 1988,
      "unesco_property_id": "499",
      "source_ids": [
        "SRC-KAI-UNESCO"
      ],
      "context_note": "The Great Mosque is within the inscribed city property, not a separately inscribed World Heritage property."
    },
    "content": {
      "en": {
        "intro": "A landmark of early Islamic architecture in North Africa, founded in the seventh century and substantially rebuilt during the Aghlabid period.",
        "history": "The early foundation dates to 670, while much of the visible architecture is ninth-century Aghlabid work.",
        "architecture": "The layout combines a porticoed courtyard, a hypostyle prayer hall and a monumental square minaret."
      },
      "fr": {
        "intro": "Un monument majeur de l’architecture islamique en Afrique du Nord, fondé au VIIe siècle et largement reconstruit à l’époque aghlabide.",
        "history": "La fondation remonte à 670, tandis que l’essentiel de l’architecture conservée date des reconstructions aghlabides du IXe siècle.",
        "architecture": "Le plan associe une cour bordée de portiques, une salle de prière hypostyle et un monumental minaret de plan carré."
      },
      "ar": {
        "intro": "معلم بارز للعمارة الإسلامية في شمال إفريقيا، تأسس في القرن السابع وأُعيد بناؤه إلى حد كبير خلال العهد الأغلبي.",
        "history": "تعود النشأة الأولى إلى سنة 670، بينما ترجع معظم العمارة القائمة إلى القرن التاسع في العهد الأغلبي.",
        "architecture": "يجمع التخطيط بين صحن تحيط به الأروقة وقاعة صلاة متعددة الأعمدة ومئذنة مربعة ضخمة."
      }
    },
    "claims": [
      {
        "id": "CLM-P01-01",
        "statement_en": "A congregational mosque was founded at Kairouan in 670.",
        "certainty": "documented",
        "source_ids": [
          "SRC-KAI-SMART"
        ],
        "review_note": null
      },
      {
        "id": "CLM-P01-02",
        "statement_en": "The mosque visible today is principally a ninth-century rebuilding.",
        "certainty": "documented",
        "source_ids": [
          "SRC-KAI-SMART",
          "SRC-KAI-UNESCO"
        ],
        "review_note": null
      },
      {
        "id": "CLM-P01-03",
        "statement_en": "The present plan includes a hypostyle prayer hall and a square three-storey minaret.",
        "certainty": "documented",
        "source_ids": [
          "SRC-KAI-UNESCO"
        ],
        "review_note": null
      },
      {
        "id": "CLM-P01-04",
        "statement_en": "The mosque belongs to the UNESCO-listed Kairouan property, inscribed in 1988.",
        "certainty": "documented",
        "source_ids": [
          "SRC-KAI-UNESCO"
        ],
        "review_note": null
      }
    ],
    "source_ids": [
      "SRC-KAI-UNESCO",
      "SRC-KAI-SMART"
    ],
    "media": [],
    "model_3d": null,
    "editorial": {
      "approval": "editorial_core_fact_checked",
      "approved_scope": "limited_verified_core",
      "scholarly_peer_review": "pending",
      "fr_ar_translation_review": "pending",
      "approved_on": "2026-10-27",
      "image_license_status": "no_reuse_cleared",
      "model_validation": "not_applicable",
      "visitor_access": "not_verified"
    },
    "provenance": {
      "legacy_id": "MOS-0001",
      "legacy_dataset": "Phase 6 crosswalk"
    }
  },
  {
    "schema_version": "1.0.0",
    "id": "MOS-0004",
    "slug": "mosque-cathedral-cordoba",
    "names": {
      "en": "Mosque–Cathedral of Córdoba",
      "fr": "Mosquée-cathédrale de Cordoue",
      "ar": "مسجد قرطبة الجامع – الكاتدرائية",
      "original": {
        "value": "Mezquita-Catedral de Córdoba",
        "language": "es"
      }
    },
    "location": {
      "city": "Córdoba",
      "country": "Spain",
      "country_iso2": "ES",
      "coordinates": null
    },
    "chronology": {
      "foundation": {
        "display": "786–788 CE (original mosque)",
        "start_year": 786,
        "end_year": 788,
        "precision": "range",
        "certainty": "documented",
        "event_type": "foundation",
        "source_ids": [
          "SRC-COR-OFFICIAL"
        ],
        "sort_year": 786
      },
      "present_structure": {
        "display": "Multi-period: 8th–16th centuries",
        "start_year": null,
        "end_year": null,
        "precision": "multi_period",
        "certainty": "documented",
        "event_type": "surviving_multi_period_structure",
        "source_ids": [
          "SRC-COR-OFFICIAL",
          "SRC-COR-UNESCO"
        ],
        "sort_year": null
      },
      "phases": [
        {
          "id": "PH-MOS-0004-01",
          "event_type": "initial_construction",
          "display_date": "786–788",
          "start_year": 786,
          "end_year": 788,
          "description_en": "Original congregational mosque built during Abd al-Rahman I.",
          "certainty": "documented",
          "source_ids": [
            "SRC-COR-OFFICIAL"
          ]
        },
        {
          "id": "PH-MOS-0004-02",
          "event_type": "extension",
          "display_date": "833–848",
          "start_year": 833,
          "end_year": 848,
          "description_en": "First substantial extension under Abd al-Rahman II.",
          "certainty": "documented",
          "source_ids": [
            "SRC-COR-OFFICIAL"
          ]
        },
        {
          "id": "PH-MOS-0004-03",
          "event_type": "extension",
          "display_date": "962–966",
          "start_year": 962,
          "end_year": 966,
          "description_en": "Expansion under al-Hakam II.",
          "certainty": "documented",
          "source_ids": [
            "SRC-COR-OFFICIAL"
          ]
        },
        {
          "id": "PH-MOS-0004-04",
          "event_type": "extension",
          "display_date": "991–994",
          "start_year": 991,
          "end_year": 994,
          "description_en": "Eastward enlargement under Almanzor.",
          "certainty": "documented",
          "source_ids": [
            "SRC-COR-OFFICIAL"
          ]
        },
        {
          "id": "PH-MOS-0004-05",
          "event_type": "change_of_use",
          "display_date": "1236",
          "start_year": 1236,
          "end_year": 1236,
          "description_en": "Consecration as a Catholic cathedral.",
          "certainty": "documented",
          "source_ids": [
            "SRC-COR-UNESCO"
          ]
        },
        {
          "id": "PH-MOS-0004-06",
          "event_type": "reconstruction",
          "display_date": "1523–1599",
          "start_year": 1523,
          "end_year": 1599,
          "description_en": "Major Renaissance interventions in the present building.",
          "certainty": "documented",
          "source_ids": [
            "SRC-COR-UNESCO"
          ]
        }
      ]
    },
    "architectural_profile": {
      "traditions": [
        "umayyad_andalusi",
        "gothic",
        "renaissance"
      ],
      "typologies": [
        "hypostyle",
        "adapted_religious_building"
      ],
      "materials": [
        "stone",
        "brick",
        "timber"
      ],
      "elements": [
        "double_arches",
        "courtyard",
        "mihrab",
        "cathedral_transept"
      ]
    },
    "heritage": {
      "relationship": "original_inscription_later_extended",
      "designation_name": "Historic Centre of Cordoba",
      "inscription_year": 1984,
      "unesco_property_id": "313",
      "source_ids": [